{
  "$schema": "http://json-schema.org/draft-07/schema#",
  "type": "object",
  "properties": {
    "status": {
      "type": "string"
    },
    "results": {
      "type": "array",
      "items": {
        "type": "object",
        "properties": {
          "url": {
            "type": "string",
            "format": "uri"
          },
          "title": {
            "type": "string"
          },
          "description": {
            "type": "string"
          },
          "content": {
            "type": "string"
          },
          "snippets": {
            "type": "string"
          },
          "content_raw": {
            "type": "string"
          },
          "markdown": {
            "type": "string"
          },
          "reader": {
            "type": "string"
          },
          "html": {
            "type": "string"
          }
        },
        "required": ["url", "title"]
      }
    },
    "qnas": {
      "type": "array",
      "items": {
        "type": "object",
        "properties": {
          "question": {
            "type": "string"
          },
          "answer": {
            "type": "string"
          },
          "link": {
            "type": "string",
            "format": "uri"
          }
        },
        "required": ["question", "answer"]
      }
    },
    "images": {
      "type": "array",
      "items": {
        "type": "object",
        "properties": {
          "src": {
            "type": "string",
            "format": "uri"
          },
          "link": {
            "type": "string",
            "format": "uri"
          },
          "width": {
            "type": "integer"
          },
          "height": {
            "type": "integer"
          }
        },
        "required": ["src"]
      }
    },
    "videos": {
      "type": "array",
      "items": {
        "type": "object",
        "properties": {
          "src": {
            "type": "string",
            "format": "uri"
          },
          "width": {
            "type": "integer"
          },
          "height": {
            "type": "integer"
          }
        },
        "required": ["src"]
      }
    },
    "related": {
      "type": "array",
      "items": {
        "type": "string"
      }
    },
    "questions": {
      "type": "array",
      "items": {
        "type": "string"
      }
    },
    "response_time": {
      "type": "number"
    }
  },
  "required": ["status", "results", "response_time"]
}
